Timestamp	Business name	Phone	Address	Email	Website	Facebook	Service offered	Opening hours	Business category	Path
05/05/2025 23:07:09	Jeans 4 U	01797862861	Lamabazar	Jeans4ulamabazar@gmail.com			Jeans, formal pants, sports trousers, twill pants, drop ahoulders, polo t shirts, zip polo t shirts, ribbed shirts,		Mens Clothing	jeans-4-u
30/07/2025 17:24:28	Travel One BD	01334912893	542, Lift-04, West World Shopping City , Zindabazar	service@travelonebd.com	Travelone.com.bd	https://www.facebook.com/Travelonebdsylhet	Student Visa, Visit Visa, Work Permit , Hajj Umrah, Air Ticket, Local Tour	Saturday To Thursday From 11 AM to 8 PM	Travel	travel-one-bd
21/08/2025 10:00:33	Ab Nahid Agency	+8801616411360	Level 8, Al Hamra Shopping City, Sylhet	info@abnahid.com	https://www.abnahid.com	https://www.facebook.com/abnahidagency	Web Development Service, Seo Service, Wordpress development	10am to 8pm	Software Development & Training	ab-nahid-agency
06/09/2025 13:12:10	Dr. Hasanul Banna Alamin	01646265036	Afiya Homeo Pharmacy,  Loharpara, Amborkhana, Sylhet Sadar, Sylhet. 	hbalamin63@gmail.com	drhasanulbannaalamin.com	https://www.facebook.com/besthomeopathydoctorsylhet	Homeopathic Treatment	11 Am	Doctor	dr-hasanul-banna-alamin
27/09/2025 11:19:56	M/S Namaz Traders	01711348593	Tuker Bazar, Sunamganj Road, Sylhet	nazmatraders93@gmail.com					Construction & Building Material	ms-namaz-traders